URL,Version,Status,OIDs,Name,Title,Description,Used
http://hl7.org/fhir/goal-status,4.0.1,draft,"2.16.840.1.113883.4.642.4.272",GoalLifecycleStatus,GoalLifecycleStatus,"Codes that reflect the current state of a goal and whether the goal is still being targeted.","ValueSet/goal-status"
http://snomed.info/sct,null,active,"2.16.840.1.113883.6.96",SNOMED_CT,SNOMED CT (all versions),"SNOMED CT is the most comprehensive and precise clinical health terminology product in the world, owned and distributed around the world by The International Health Terminology Standards Development Organisation (IHTSDO).","ValueSet/clinical-findings,ValueSet/goal-start-event"
http://terminology.hl7.org/CodeSystem/goal-achievement,1.0.1,active,"2.16.840.1.113883.4.642.1.1375",GoalAchievementStatus,Goal achievement status,"Describes the progression, or lack thereof, towards the goal against the target.","ValueSet/goal-achievement"
http://terminology.hl7.org/CodeSystem/goal-category,2.0.0,active,"2.16.840.1.113883.4.642.1.1097",GoalCategory,Goal category,"Codes for grouping goals to use for filtering or presentation.","ValueSet/goal-category"
http://terminology.hl7.org/CodeSystem/goal-priority,1.0.1,active,"2.16.840.1.113883.4.642.1.1096",GoalPriority,Goal priority,"Indicates the level of importance associated with reaching or sustaining a goal.","ValueSet/goal-priority"
